"date","name","description","type","religious_holiday","local_holiday","national_holiday","worldwide_observance"
2019-10-25,Nevada Day,"Nevada Day is an annual state holiday celebrated in Nevada, the United States, on the last Friday of October. It commemorates the statehood of Nevada, which took place on October 31, 1864.",Local holiday,false,true,false,false
2019-10-26,,,,false,false,false,false
2019-10-27,World Day for Audiovisual Heritage,The World Day for Audiovisual Heritage is observed on October 27 every year.,United Nations observance,false,false,false,false
2019-10-27,Diwali/Deepavali,"Diwali, also known as the Festival of Lights, is one of the most popular Hindu festivals.",Hinduism,true,false,false,false
2019-10-28,,,,false,false,false,false
2019-10-29,World Stroke Day,World Stroke Day is annually held on October 29 to raise awareness about stroke and ways to combat it.,Worldwide observance,false,false,false,true
2019-10-30,,,,false,false,false,false
2019-10-31,World Cities Day,World Cities Day is a UN observance that aims to recognize the role of cities as  a foundation for social and economic development.,United Nations observance,false,false,false,false
2019-10-31,Halloween,"Halloween is celebrated by hosting costume parties, playing 'trick-or-treat', watching horror films, visiting haunted houses or carving lanterns out of pumpkins.",Observance,false,false,false,false
2019-11-01,World Vegan Day,World Vegan Day is an annual observation that brings together vegans around the world to bring attention to animal rights and to spread the word about the health advantages of following a vegan diet.,Worldwide observance,false,false,false,true
2019-11-01,First Day of Native American Heritage Month,First Day of Native American Heritage Month is a annual monthly observance in the USA,Observance,false,false,false,false
2019-11-01,All Saints' Day,"Many Catholics honor all the saints on All Saints' Day, also known as All Hallows' Day, in the United States.",Christian,true,false,false,false
2019-11-02,International Day to End Impunity for Crimes against Journalists,The International Day to End Impunity for Crimes against Journalists raises awareness about violence against journalists.,United Nations observance,false,false,false,false
2019-11-02,All Souls' Day,"Prayers for the dead are made on All Souls’ Day in the United States, which falls on November 2 each year. The Day of the Dead is also celebrated on this day.",Christian,true,false,false,false
2019-11-03,New York City Marathon,The New York City Marathon is one of the world's largest marathons and takes place every year in November.,Sporting event,false,false,false,false
2019-11-03,Daylight Saving Time ends,Daylight Saving Time ends in the USA,Clock change/Daylight Saving Time,false,false,false,false
2019-11-04,,,,false,false,false,false
2019-11-05,World Tsunami Awareness Day,World Tsunami Awareness Day is a United Nations observance in the USA,United Nations observance,false,false,false,false
2019-11-05,Election Day,Election Day in the United States of America is the day on which popular ballots are held to select public officials.,Observance,false,false,false,false
2019-11-06,International Day for Preventing the Exploitation of the Environment in War and Armed Conflict,The United Nations’ (UN) International Day for Preventing the Exploitation of the Environment in War and Armed Conflict is held on November 6 each year.,United Nations observance,false,false,false,false
2019-11-07,,,,false,false,false,false
2019-11-08,,,,false,false,false,false
2019-11-09,The Prophet's Birthday,Eid Milad ul-Nabi (Mawlid or Milad-un-Nabi) commemorates the Prophet Muhammed's birthday.,Muslim,true,false,false,false
2019-11-10,World Science Day for Peace and Development,The World Science Day for Peace and Development (WSDPD) is celebrated on November 10 each year.,United Nations observance,false,false,false,false
2019-11-10,Marine Corps Birthday,"Marine Corps Birthday celebrates the establishment of the United States Marine Corps on November 10, 1775.",Observance,false,false,false,false
2019-11-11,Veterans Day,Veterans Day in the USA is a holiday to honor all who have served in the United States Military Services.,National holiday,false,false,true,false
2019-11-11,Singles’ Day,"",Worldwide observance,false,false,false,true
2019-11-12,World Pneumonia Day,"World Pneumonia Day supports all efforts made to protect and treat people against pneumonia, the single largest cause of child deaths worldwide.",Worldwide observance,false,false,false,true
2019-11-13,,,,false,false,false,false
2019-11-14,World Diabetes Day,World Diabetes Day is held annually to raise awareness of diabetes and its complications and the care that people with this condition need. It is observed on November 14 each year.,United Nations observance,false,false,false,false
2019-11-15,,,,false,false,false,false
2019-11-16,International Day for Tolerance,The United Nations’ (UN) International Day for Tolerance is observed on November 16 each year to help people understand the importance of tolerance worldwide.,United Nations observance,false,false,false,false
2019-11-17,World Prematurity Day, World Prematurity Day is an annual observance that is dedicated to raising awareness about the health and emotional issues surrounding preterm birth.,Worldwide observance,false,false,false,true
2019-11-17,World Day of Remembrance for Road Traffic Victims,The World Day of Remembrance for Road Traffic Victims serves as a major advocacy day for road traffic injury prevention.,United Nations observance,false,false,false,false
2019-11-18,,,,false,false,false,false
2019-11-19,World Toilet Day,World Toilet Day aims to promote public awareness of the need for adequate toilets to improve people’s health and save lives.,United Nations observance,false,false,false,false
2019-11-19,International Men's Day,International Men’s Day celebrates men's achievements worldwide and throughout history.,Worldwide observance,false,false,false,true
2019-11-20,Universal Children's Day,The United Nations' (UN) Universal Children's Day is an occasion to promote the welfare of children and an understanding between children all over the world. It is held on November 20 each year,United Nations observance,false,false,false,false
2019-11-20,Transgender Day of Remembrance,Transgender Day of Remembrance is a worldwide observance in the USA,Worldwide observance,false,false,false,true
2019-11-20,Africa Industrialization Day,Africa Industrialization Day aims to stimulate the international community's commitment to the industrialization of Africa.,United Nations observance,false,false,false,false
2019-11-21,World Television Day,The United Nations’ (UN) World Television Day is globally celebrated on November 21 each year.,United Nations observance,false,false,false,false
2019-11-21,World Philosophy Day,World Philosophy Day is celebrated on the third Thursday of November each year.,United Nations observance,false,false,false,false
2019-11-22,,,,false,false,false,false
2019-11-23,,,,false,false,false,false
2019-11-24,,,,false,false,false,false
2019-11-25,International Day for the Elimination of Violence against Women,The United Nations' (UN) International Day for the Elimination of Violence against Women raises public awareness of violence against women in all countries around the world and at all levels of society. It is observed each year on November 25.,United Nations observance,false,false,false,false
2019-11-26,,,,false,false,false,false
2019-11-27,,,,false,false,false,false
2019-11-28,Thanksgiving Day,Thanksgiving Day in the United States is traditionally a holiday to give thanks for the food collected at the end of the harvest season.,National holiday,false,false,true,false
2019-11-29,Presidents' Day (Observed),Presidents' Day (Observed) is a state holiday in the USA,Local holiday,false,true,false,false
2019-11-29,Nellie Tayloe Ross's Birthday,Nellie Tayloe Ross's Birthday is a state observance in the USA,Local observance,false,false,false,false
2019-11-29,Native American Heritage Day,Native American Heritage Day is a state holiday in the USA,Local holiday,false,true,false,false
2019-11-29,Lincoln's Birthday/Lincoln's Day,"Lincoln’s Birthday is observed in the United States in honor of Abraham Lincoln, who was the nation’s 16th president and was known as the Great Emancipator.",Local holiday,false,true,false,false
2019-11-29,International Day of Solidarity with the Palestinian People,The United Nations’ (UN) International Day of Solidarity with the Palestinian People is annually observed on November 29.,United Nations observance,false,false,false,false
2019-11-29,Family Day,"The Day After Thanksgiving, also known as Black Friday, is a state holiday more than 20 states.",Local holiday,false,true,false,false
2019-11-29,Day After Thanksgiving,"The Day After Thanksgiving, also known as Black Friday, is a state holiday more than 20 states.",Local holiday,false,true,false,false
2019-11-29,Black Friday,Black Friday is the day after Thanksgiving Day in the USA. It is a busy shopping day and is a holiday in some states.,Observance,false,false,false,false
2019-11-29,American Indian Heritage Day,American Indian Heritage Day is often observed on the Friday after Thanksgiving Day in the United States.,Local holiday,false,true,false,false
2019-11-29,Acadian Day,"The Day After Thanksgiving, also known as Black Friday, is a state holiday more than 20 states.",Local holiday,false,true,false,false
2019-11-30,Day of Remembrance for all Victims of Chemical Warfare,The UN’s Day of Remembrance for all Victims of Chemical Warfare is annually observed on April 29.,United Nations observance,false,false,false,false
2019-12-01,World AIDS Day,The United Nations' (UN) World AIDS Day is annually observed on December 1.,United Nations observance,false,false,false,false
2019-12-01,Rosa Parks Day,The life of American civil rights leader Rosa Parks is celebrated in the United States on either February 4 or December 1.,Local observance,false,false,false,false
2019-12-01,First Sunday of Advent,"Many Christians in the United States observe the first Sunday of Advent, which marks the start of the Christian year.",Christian,true,false,false,false
2019-12-02,International Day for the Abolition of Slavery,The United Nations’ (UN) International Day for the Abolition of Slavery is annually observed on December 2.,United Nations observance,false,false,false,false
2019-12-02,Cyber Monday,Most online retailers in the US offer discounted prices on their products and services on Cyber Monday.,Observance,false,false,false,false
2019-12-03,International Day of Persons with Disabilities,The United Nations' (UN) International Day of Persons with Disabilities is annually observed on December 3 to re-affirm and draw attention to the rights of people who live with disabilities.,United Nations observance,false,false,false,false
2019-12-03,Giving Tuesday,"",Worldwide observance,false,false,false,true
2019-12-04,,,,false,false,false,false
2019-12-05,World Soil Day,World Soil Day raises awareness of why soil is needed for sustainable living.,United Nations observance,false,false,false,false
2019-12-05,International Volunteer Day for Economic and Social Development,"The United Nations’ (UN) International Volunteer Day for Economic and Social Development, also known as International Volunteer Day (IVD), is observed on December 5 each year.",United Nations observance,false,false,false,false
2019-12-06,St Nicholas Day,Some churches in the United States recognize St Nicholas' Day as a feast day.,Observance,false,false,false,false
2019-12-07,Pearl Harbor Remembrance Day,"National Pearl Harbor Remembrance Day remembers those who died or were injured when Pearl Harbor, in Hawaii, was attacked in 1941.",Local observance,false,false,false,false
2019-12-07,International Civil Aviation Day,International Civil Aviation Day is observed globally on December 7 each year. It is observed by organizations such as the International Civil Aviation Organization (ICAO).,United Nations observance,false,false,false,false
2019-12-07,Delaware Day,Delaware Day is a state observance in the USA,Local observance,false,false,false,false
2019-12-08,,,,false,false,false,false
2019-12-09,World Genocide Commemoration Day,World Genocide Commemoration Day is a UN holiday dedicated to the victims of genocide.,United Nations observance,false,false,false,false
2019-12-09,International Anti-Corruption Day,The United Nations’ (UN) International Anti-Corruption Day is annually observed on December 9 to raise public awareness of corruption and ways to fight it.,United Nations observance,false,false,false,false
2019-12-09,Green Monday,The last Monday at least ten days before Christmas has been dubbed “Green Monday” by online marketers.,Worldwide observance,false,false,false,true
2019-12-09,Feast of the Immaculate Conception,The Feast of the Immaculate Conception is a Christian observance on December 8 each year.,Christian,true,false,false,false
2019-12-10,Wyoming Day,Wyoming Day is a state observance in the USA,Local observance,false,false,false,false
2019-12-10,Human Rights Day,Human Rights Day marks the anniversary of when the Universal Declaration of Human Rights was proclaimed.,United Nations observance,false,false,false,false
2019-12-11,International Mountain Day,"The United Nations' (UN) International Mountain Day is an occasion to help raise awareness of the people who live in mountainous regions and the role that these regions play in providing food, water, and recreation. It is observed on December 11 each year.",United Nations observance,false,false,false,false
2019-12-12,International Universal Health Coverage Day,International Universal Health Coverage Day is a United Nations observance in the USA,United Nations observance,false,false,false,false
2019-12-12,International Day of Neutrality,International Day of Neutrality is a United Nations observance in the USA,United Nations observance,false,false,false,false
2019-12-12,Feast of Our Lady of Guadalupe,"The Feast of Our Lady Guadalupe, in honor of Jesus’ mother Mary, is a Catholic observance in the United States.",Christian,true,false,false,false
2019-12-13,National Guard Birthday,National Guard Birthday is a observance in the USA,Observance,false,false,false,false
2019-12-13,Friday the 13th,Friday the 13th is a day full of superstitious beliefs in communities worldwide.,Worldwide observance,false,false,false,true
2019-12-14,,,,false,false,false,false
2019-12-15,Bill of Rights Day,Bill of Rights Day is a observance in the USA,Observance,false,false,false,false
2019-12-16,,,,false,false,false,false
2019-12-17,Wright Brothers Day,The Wright Brothers Day is annually celebrated in the United States on December 17 to commemorate the historic flight made by Orville and Wilbur Wright on that date in 1903.,Observance,false,false,false,false
2019-12-17,Pan American Aviation Day,"December 17 marks Pan American Aviation Day, which is annually observed in the United States.",Observance,false,false,false,false
2019-12-18,International Migrants Day,The United Nations (UN) International Migrants Day is celebrated on December 18 each year.,United Nations observance,false,false,false,false
2019-12-18,Arabic Language Day,World Arabic Language Day is a United Nations (UN) observance that celebrates one of the organization’s 6 official languages – Arabic.,United Nations observance,false,false,false,false
2019-12-19,,,,false,false,false,false
2019-12-20,International Human Solidarity Day,The United Nations' (UN) International Human Solidarity Day is celebrated on December 20 each year to raise public awareness on the importance of solidarity in fighting poverty.,United Nations observance,false,false,false,false
2019-12-21,Super Saturday,"The final Saturday before Christmas has become a very popular shopping day in the US, earning the nickname Super Saturday.",Worldwide observance,false,false,false,true
2019-12-21,December Solstice,December Solstice in the USA (New York),Season,false,false,false,false
2019-12-22,,,,false,false,false,false
2019-12-23,Chanukah/Hanukkah (first day),"The first day of Hanukkah is the start of the Hanukkah period, which lasts for eight days, from the 25th day of the month of Kislev to the second day of Tevet in the Hebrew calendar.",Hebrew,true,false,false,false
2019-12-24,Washington's Birthday,Washington's Birthday is a state holiday in the USA,Local holiday,false,true,false,false
2019-12-24,Christmas Eve,Christmas Eve in the United States is on December 24 each year.,National holiday,false,false,true,false
2019-12-25,Christmas Day,Christmas Day celebrates Jesus Christ's birth.,"National holiday, Christian",true,false,true,false
2019-12-26,Kwanzaa (first day),"Kwanzaa is a week-long holiday honoring the culture and traditions of African people and their descendants worldwide, especially in the United States.",Observance,false,false,false,false
2019-12-26,Day After Christmas Day,Some states in the United States observe the Day after Christmas Day as a public holiday.,Local holiday,false,true,false,false
2019-12-27,,,,false,false,false,false
2019-12-28,,,,false,false,false,false
2019-12-29,,,,false,false,false,false
2019-12-30,Last Day of Chanukah,"The last day of Hanukkah marks the end of a festive Jewish occasion, known as Hanukkah or Chanukah.",Hebrew,true,false,false,false
2019-12-31,New Year's Eve,New Year's Eve is the last day of the year in the Gregorian calendar. Many parties to welcome the New Year are held in in the United States on New Year's Eve.,Observance,false,false,false,false
