"date","name","description","type","religious_holiday","local_holiday","national_holiday","worldwide_observance"
2019-07-06,International Day of Cooperatives,"The United Nations' (UN) International Day of Cooperatives recognizes and reaffirms the role of cooperatives in economic, social and cultural development and in the achievement of social policy objectives.",United Nations observance,false,false,false,false
2019-07-07,,,,false,false,false,false
2019-07-08,,,,false,false,false,false
2019-07-09,,,,false,false,false,false
2019-07-10,,,,false,false,false,false
2019-07-11,World Population Day,The United Nations' (UN) World Population Day reaffirms the human right to plan for a family.,United Nations observance,false,false,false,false
2019-07-12,,,,false,false,false,false
2019-07-13,Nathan Bedford Forrest Day,Nathan Bedford Forrest Day is a local observance in the USA,Local observance,false,false,false,false
2019-07-14,Bastille Day,Bastille Day is a observance in the USA,Observance,false,false,false,false
2019-07-15,World Youth Skills Day,Acquiring skills enhances youths' ability to make informed choices and empowers them to gain access to changing labor markets.,United Nations observance,false,false,false,false
2019-07-16,Rural Transit Day,Rural Transit Day is a observance in the USA,Observance,false,false,false,false
2019-07-17,,,,false,false,false,false
2019-07-18,Nelson Mandela Day,Nelson Mandela International Day is annually observed on July 18 to recognize the former South African president’s contribution to peace and freedom.,United Nations observance,false,false,false,false
2019-07-19,,,,false,false,false,false
2019-07-20,,,,false,false,false,false
2019-07-21,,,,false,false,false,false
2019-07-22,,,,false,false,false,false
2019-07-23,,,,false,false,false,false
2019-07-24,Pioneer Day,Pioneer Day is an annual state holiday in Utah in the United States. It is celebrated to honor the pioneers who demonstrated industry and bravery when they ventured to settle in a place that is now Salt Lake City.,Local holiday,false,true,false,false
2019-07-25,,,,false,false,false,false
2019-07-26,,,,false,false,false,false
2019-07-27,National Korean War Veterans Armistice Day,National Korean War Veterans Armistice Day is a observance in the USA,Observance,false,false,false,false
2019-07-27,Korean War Veteran Recognition Day,Korean War Veteran Recognition Day is a state observance in the USA,Local observance,false,false,false,false
2019-07-28,World Hepatitis Day,World Hepatitis Day is observed on July 28 every year to raise awareness of hepatitis and encourage prevention and treatment.,United Nations observance,false,false,false,false
2019-07-28,Parents' Day,Parents’ Day is celebrated in the United States on the fourth Sunday of July each year to recognize and promote parenting as a crucial part of families and the wider community.,Observance,false,false,false,false
2019-07-29,,,,false,false,false,false
2019-07-30,World Day Against Trafficking in Persons,July 30 is the UN World Day Against Trafficking in Persons,United Nations observance,false,false,false,false
2019-07-30,International Day of Friendship,The International Day of Friendship is annually held on July 30 to celebrate friendships worldwide.,United Nations observance,false,false,false,false
2019-07-31,,,,false,false,false,false
2019-08-01,Colorado Day,"Colorado Day is an annual observance that commemorates the state’s birthday on August 1, 1876, and its history.",Local observance,false,false,false,false
2019-08-02,,,,false,false,false,false
2019-08-03,,,,false,false,false,false
2019-08-04,Coast Guard Birthday,Coast Guard Birthday is a observance in the USA,Observance,false,false,false,false
2019-08-04,Barack Obama Day,Barack Obama Day is a observance in the USA,Observance,false,false,false,false
2019-08-04,American Family Day,American Family Day is a state holiday in the USA,Local holiday,false,true,false,false
2019-08-05,,,,false,false,false,false
2019-08-06,,,,false,false,false,false
2019-08-07,Purple Heart Day,Purple Heart Day on August 7 commemorates the day in 1782 when General George Washington created the Purple Heart Medal – a military decoration that is awarded to those wounded or killed while serving in the United States Armed Forces.,Local observance,false,false,false,false
2019-08-08,,,,false,false,false,false
2019-08-09,International Day of the World's Indigenous People,The United Nations’ (UN) International Day of the World's Indigenous People is observed on August 9 each year to promote and protect the rights of the world’s indigenous peoples.,United Nations observance,false,false,false,false
2019-08-10,,,,false,false,false,false
2019-08-11,Tisha B'Av,Tisha B’Av is on the ninth day of the month of Av in the Jewish calendar.,Hebrew,true,false,false,false
2019-08-11,Eid al-Adha,"For more than 3 millions Muslims in the US, Eid al-Adha, the Festival of Sacrifice, is one of the most important dates in the calendar.",Muslim,true,false,false,false
2019-08-12,Victory Day,"Victory Day, also known as VJ Day, is an annual state holiday celebrated on the second Monday in August in Rhode Island in the United States. It marks the anniversary of the Allies’ victory over Japan during World War II.",Local holiday,false,true,false,false
2019-08-12,International Youth Day,The United Nations’ (UN) International Youth Day is annually held on August 12 to celebrate the achievements of the world’s youth and to encourage their participation in enhancing society.,United Nations observance,false,false,false,false
2019-08-13,,,,false,false,false,false
2019-08-14,Raksha Bandhan,Raksha Bandhan is a Hindu festival that is celebrated on the full moon of the Hindu month of Shravana (Shravan Poornima). The day is also sometimes referred to as Brother and Sister Day because it honors the relationship between brother and sister.,Hinduism,true,false,false,false
2019-08-15,Assumption of Mary,Assumption Day is a Christian observance in the United States that is held annually on August 15. Catholics observe the Dormition (falling asleep) or the day that the Blessed Virgin Mary was received into heaven.,Christian,true,false,false,false
2019-08-16,Hawaii Statehood Day,Hawaii’s Statehood Day is celebrated on the third Friday of August to commemorate the anniversary of Hawaii’s statehood.,Local holiday,false,true,false,false
2019-08-16,Bennington Battle Day,Bennington Battle Day is a state holiday in Vermont. It commemorates the American victory at the Battle of Bennington during the Revolutionary War in north America in 1777.,Local holiday,false,true,false,false
2019-08-17,,,,false,false,false,false
2019-08-18,National Senior Citizens Day,National Senior Citizens Day is an observance on the third Sunday of August to honor the contributions of senior citizens in the United States.,Observance,false,false,false,false
2019-08-18,National Navajo Code Talkers Day,National Navajo Code Talkers Day is a state holiday in the USA,Local holiday,false,true,false,false
2019-08-19,World Humanitarian Day,The United Nations’(UN) World Humanitarian Day focuses on increasing public awareness about humanitarian service worldwide and is annually observed on August 19.,United Nations observance,false,false,false,false
2019-08-19,National Aviation Day,National Aviation Day is observed in the United States on August 19 each year to celebrate the history and development of the aviation.,Observance,false,false,false,false
2019-08-20,,,,false,false,false,false
2019-08-21,International Day of Remembrance of and Tribute to the Victims of Terrorism,International Day of Remembrance of and Tribute to the Victims of Terrorism is a United Nations observance in the USA,United Nations observance,false,false,false,false
2019-08-22,International Day Commemorating the Victims of Acts of Violence Based on Religion or Belief,International Day Commemorating the Victims of Acts of Violence Based on Religion or Belief is a United Nations observance in the USA,United Nations observance,false,false,false,false
2019-08-23,Janmashtami,"Krishna Janmashtami is a Hindu festival that celebrates the birth of Krishna, the eighth incarnation of the god Vishnu. It is celebrated on the eighth day of the Hindu month of Bhadrava (Bhadrapada), which is usually in August or September.",Hinduism,true,false,false,false
2019-08-23,International Day for the Remembrance of the Slave Trade and its Abolition,The United Nations’ (UN) International Day for the Remembrance of the Slave Trade and its Abolition is held on August 23 each year to remind people of the tragedy of the transatlantic slave trade.,United Nations observance,false,false,false,false
2019-08-24,,,,false,false,false,false
2019-08-25,,,,false,false,false,false
2019-08-26,Women's Equality Day,Women's Equality Day on August 26 is an annual observance that commemorates the anniversary of the first time voting rights were extended to women in the United States.,Observance,false,false,false,false
2019-08-27,Lyndon Baines Johnson Day,"Lyndon Baines Johnson Day is a state holiday in Texas in the United States on August 27 each year. It commemorates the birthday of Lyndon Baines Johnson, who was the 36th president of the USA.",Local holiday,false,true,false,false
2019-08-28,,,,false,false,false,false
2019-08-29,International Day against Nuclear Tests,The United Nations’ (UN) International Day against Nuclear Tests is annually observed on August 29. The day raises awareness of the dangers of nuclear weapons and a closer approach to eliminating the use of those weapons.,United Nations observance,false,false,false,false
2019-08-30,International Day of the Victims of Enforced Disappearances,The International Day of the Victims of Enforced Disappearances is annually observed on August 30.,United Nations observance,false,false,false,false
2019-08-31,Muharram,"The first day of Muharram, which is the first month in the Islamic calendar, marks the start of the Islamic New Year.",Muslim,true,false,false,false
2019-08-31,International Overdose Awareness Day, International Overdose Awareness Day is an annual observation which aims to raise global awareness of about the impact of drug overdose on families and communities. The campaign also attempts to remove the stigma associated with overdose.,Worldwide observance,false,false,false,true
2019-09-01,,,,false,false,false,false
2019-09-02,Labor Day,Labor Day is a federal holiday in the United States. It gives workers a day of rest and it celebrates their contribution to the American economy.,National holiday,false,false,true,false
2019-09-02,Ganesh Chaturthi,"Ganesh Chaturthi is the great Ganesha festival that celebrates the birthday of Lord Ganesha during the Hindu Month of Bhadra, which usually falls between mid-August and mid-September. It is also known as Vinayaka Chaturthi and can last up to 10 days.",Hinduism,true,false,false,false
2019-09-03,,,,false,false,false,false
2019-09-04,World Sexual Health Day, World Sexual Health Day is an annual awareness day that attempts to break down social and cultural taboos associated with sexuality and to promote sexual health around the world.,Worldwide observance,false,false,false,true
2019-09-05,International Day of Charity,The International Day of Charity raises public awareness of what charities do to help minimize poverty.,United Nations observance,false,false,false,false
2019-09-06,,,,false,false,false,false
2019-09-07,Still's Disease Awareness Day,Still's Disease Awareness Day is a worldwide observance in the USA,Worldwide observance,false,false,false,true
2019-09-07,Carl Garner Federal Lands Cleanup Day,Carl Garner Federal Lands Cleanup Day encourages people in the United States to participate in cleaning up the federal lands. It is observed on the first Saturday after Labor Day.,Observance,false,false,false,false
2019-09-08,National Grandparents Day,National Grandparents Day is celebrated on the first Sunday of September after Labor Day in the United States.,Observance,false,false,false,false
2019-09-08,International Literacy Day,The United Nations' (UN) International Literacy Day is held on September 8 each year.,United Nations observance,false,false,false,false
2019-09-09,California Admission Day,"California Admission Day is an annual legal observance in California, in the United States.",Local holiday,false,true,false,false
2019-09-10,World Suicide Prevention Day,World Suicide Prevention Day promotes worldwide action to prevent suicides on September 10 each year.,Worldwide observance,false,false,false,true
2019-09-10,Ashura,Ashura is a Muslim in the USA,Muslim,true,false,false,false
2019-09-11,Patriot Day,"Patriot Day is held in memory of nearly 3000 people who died during terrorist attacks in New York, Washington DC and Shanksville, Pennsylvania, in the United States.",Observance,false,false,false,false
2019-09-11,First Responders Day,First Responders Day is a state observance in the USA,Local observance,false,false,false,false
2019-09-12,International Day for South-South Cooperation,The United Nations Day for South-South Cooperation is observed on September 12 each year.,United Nations observance,false,false,false,false
2019-09-13,International Programmers' Day,"Many people celebrate International Programmers’ Day on January 7, while others observe this event on the 256th day of the year, usually on September 13 or on September 12 in leap years.",Worldwide observance,false,false,false,true
2019-09-14,,,,false,false,false,false
2019-09-15,International Day of Democracy,The United Nations’ (UN) International Day of Democracy is observed on September 15 each year.,United Nations observance,false,false,false,false
2019-09-15,First Day of National Hispanic Heritage Month,First Day of National Hispanic Heritage Month is a annual monthly observance in the USA,Observance,false,false,false,false
2019-09-15,Constitution Commemoration Day,Constitution Day and Citizenship Day is a combined event that occurs in the United States on September 17 each year.,Local holiday,false,true,false,false
2019-09-16,International Day for the Preservation of the Ozone Layer,The United Nations' (UN) International Day for the Preservation of the Ozone Layer focuses on the importance of protecting human health and the environment.,United Nations observance,false,false,false,false
2019-09-17,World Patient Safety Day,World Patient Safety Day is a United Nations observance in the USA,United Nations observance,false,false,false,false
2019-09-17,Constitution Day and Citizenship Day,Constitution Day and Citizenship Day is a combined event that occurs in the United States on September 17 each year.,Observance,false,false,false,false
2019-09-18,Air Force Birthday,Air Force Birthday is a observance in the USA,Observance,false,false,false,false
2019-09-19,,,,false,false,false,false
2019-09-20,National POW/MIA Recognition Day,National POW/MIA Recognition Day is annually observed in the United States on the third Friday of September.,Observance,false,false,false,false
2019-09-21,National CleanUp Day,National CleanUp Day is a observance in the USA,Observance,false,false,false,false
2019-09-21,International Day of Peace,"The United Nations' (UN) International Day of Peace is annually held on September 21 to recognize the efforts of individuals, organizations and governments to end conflict and promote peace.",United Nations observance,false,false,false,false
2019-09-22,,,,false,false,false,false
2019-09-23,September Equinox,September Equinox in the USA (New York),Season,false,false,false,false
2019-09-23,International Day of Sign Languages,International Day of Sign Languages is a United Nations observance in the USA,United Nations observance,false,false,false,false
2019-09-23,International Celebrate Bisexuality Day,"International Celebrate Bisexuality Day, also known as Bi Visibility Day, promotes the rights of bisexual people around the world.",Worldwide observance,false,false,false,true
2019-09-23,American Indian Day,American Indian Day is a state observance in the USA,Local observance,false,false,false,false
2019-09-24,,,,false,false,false,false
2019-09-25,,,,false,false,false,false
2019-09-26,World Maritime Day,"World Maritime Day is held on the last week of September each year, although the exact date is up to individual governments around the world.",United Nations observance,false,false,false,false
2019-09-26,International Day for the Total Elimination of Nuclear Weapons,The International Day for the Total Elimination of Nuclear Weapons raises awareness about the dangers of nuclear weapons.,United Nations observance,false,false,false,false
2019-09-27,World Tourism Day,The United Nations’ (UN) World Tourism Day is annually held on September 27 to raise awareness on the benefits of tourism.,United Nations observance,false,false,false,false
2019-09-27,Native American Day,"Native Americans' Day, on the second Monday of October, is celebrated some parts of the United States in lieu of Columbus Day.",Local observance,false,false,false,false
2019-09-27,Michigan Indian Day,Michigan Indian Day is a state observance in the USA,Local observance,false,false,false,false
2019-09-28,World Rabies Day,World Rabies Day is annually observed on September 28 to raise awareness about rabies and how it can be prevented.,Worldwide observance,false,false,false,true
2019-09-28,National Public Lands Day,National Public Lands Day is a observance in the USA,Observance,false,false,false,false
2019-09-29,World Heart Day,World Heart Day raises awareness of cardiovascular diseases and ways to reduce their risk.,Worldwide observance,false,false,false,true
2019-09-29,Navratri,Navratri is a Hindu holiday in the USA,Hinduism,true,false,false,false
2019-09-29,Gold Star Mother's Day,Gold Star Mother’s Day is annually observed in the United States on the last Sunday of September.,Observance,false,false,false,false
2019-09-30,Rosh Hashana,Rosh Hashanah is the Jewish New Year. Many Jewish-run organizations in the US are closed during the two-day celebration.,Local holiday,false,true,false,false
2019-09-30,International Translation Day,International Translation Day is a United Nations observance in the USA,United Nations observance,false,false,false,false
2019-10-01,World Vegetarian Day,"World Vegetarian Day is an annual observation that spreads awareness about the health, environmental, and ethical benefits of following a vegetarian lifestyle. The unofficial holiday encourages people to avoid eating foods that include animal products and to adopt a plant-based diet.",Worldwide observance,false,false,false,true
2019-10-01,International Day of Older Persons,The United Nations' (UN) International Day of Older Persons is celebrated on October 1 each year as a special day for older persons worldwide.,United Nations observance,false,false,false,false
2019-10-02,International Day of Non-Violence,The United Nations’ (UN) International Day of Non-Violence is a globally observed on October 2 each year to promote non-violence.,United Nations observance,false,false,false,false
2019-10-03,,,,false,false,false,false
2019-10-04,Feast of St Francis of Assisi,"Many Catholics in the United States, particularly those with pets, celebrate the Feast of St Francis of Assisi, the patron saint of animals and the environment, on October 4 each year.",Christian,true,false,false,false
2019-10-05,World Teachers' Day,The United Nations' (UN) World Teachers' Day commemorates the work of teachers and their contributions to society. It is observed on October 5 each year.,United Nations observance,false,false,false,false
2019-10-06,World Cerebral Palsy Day,"World Cerebral Palsy Day is an annual awareness observation that brings together people with cerebral palsy, their families and loved ones, and organizations working to ensure equal rights for them.",Worldwide observance,false,false,false,true
2019-10-06,German American Day,German American Day is a observance in the USA,Observance,false,false,false,false
2019-10-07,World Habitat Day,The United Nations’ (UN) World Habitat Day reflects on the state of human settlements and people’s right to sufficient shelter.,United Nations observance,false,false,false,false
2019-10-07,Dussehra,Dussehra is a Hindu holiday in the USA,Hinduism,true,false,false,false
2019-10-07,Child Health Day,Child Health Day is annually celebrated in the United States on the first Monday of October.,Observance,false,false,false,false
2019-10-08,,,,false,false,false,false
2019-10-09,Yom Kippur,Yom Kippur is an important Jewish holiday that falls on the 10th day of the month of Tishrei in the Jewish calendar.,Local holiday,false,true,false,false
2019-10-09,World Post Day,World Post Day marks the anniversary of the Universal Postal Union's establishment in 1874. It is held on October 9 each year.,United Nations observance,false,false,false,false
2019-10-09,Leif Erikson Day,Leif Erikson Day honors the first Scandinavian known to have set foot on American soil and the contribution of the Nordic peoples to the United States.,Local observance,false,false,false,false
2019-10-09,International Day for Natural Disaster Reduction,The United Nations’ (UN) International Day for Natural Disaster Reduction is annually observed on the second Wednesday of October to promote a global culture of natural disaster risk reduction.,United Nations observance,false,false,false,false
2019-10-10,World Sight Day,World Sight Day is annually held on the second Thursday of October to raise awareness about blindness and vision impairment.,Worldwide observance,false,false,false,true
2019-10-10,World Mental Health Day,"World Mental Health Day, which is supported by the United Nations (UN), is annually held on October 10 to raise public awareness about mental health issues worldwide.",United Nations observance,false,false,false,false
2019-10-11,International Day of the Girl Child,The International Day of the Girl Child is a United Nations (UN) observance on October 11 each year.,United Nations observance,false,false,false,false
2019-10-11,Anniversary of Death of General Pulaski,"Casimir Pulaski Day is a day off for some schools and offices in Illinois, USA, on the first Monday of March each year.",Local observance,false,false,false,false
2019-10-12,,,,false,false,false,false
2019-10-13,Navy Birthday,"Navy Birthday celebrates the establishment of the United States Navy on October 13, 1775.",Observance,false,false,false,false
2019-10-13,Chicago Marathon,The Chicago Marathon is one of the six World Marathon Majors and is held annually in October.,Sporting event,false,false,false,false
2019-10-14,Indigenous People's Day,Indigenous People's Day is a state observance in the USA,Local observance,false,false,false,false
2019-10-14,Fraternal Day,Fraternal Day is a state holiday in the USA,Local holiday,false,true,false,false
2019-10-14,First Day of Sukkot,"The first day of Sukkot marks the start of the Sukkot festival for Jewish communities in many countries, including the United States.",Hebrew,true,false,false,false
2019-10-14,Columbus Day,Columbus Day celebrates 15th century explorer Christopher Columbus's arrival in America in 1492.,Local holiday,false,true,false,false
2019-10-15,White Cane Safety Day,White Cane Safety Day is a United States observance annually held on October 15 to celebrate blind and visually impaired people's achievements and the importance of the white cane.,Observance,false,false,false,false
2019-10-15,International Day of Rural Women,The United Nations’ (UN) International Day of Rural Women is annually celebrated on October 15 to recognize rural women’s role in supporting their communities.,United Nations observance,false,false,false,false
2019-10-16,World Food Day,World Food Day is celebrated on October 16 each year.,United Nations observance,false,false,false,false
2019-10-16,Boss's Day,"Boss’s Day is observed in many workplaces in the United States on October 16, or the nearest working day, each year.",Observance,false,false,false,false
2019-10-17,International Day for the Eradication of Poverty,The United Nations’ (UN) International Day for the Eradication of Poverty is annually observed on October 17 to promote awareness of the need to eradicate poverty worldwide.,United Nations observance,false,false,false,false
2019-10-18,Alaska Day,"Alaska Day is an official holiday in Alaska, the United States, on October 18 each year. It commemorates the formal transfer of Alaska from Russia to the United States on October 18, 1867.",Local holiday,false,true,false,false
2019-10-19,Sweetest Day,Sweetest Day is a observance in the USA,Observance,false,false,false,false
2019-10-20,Last Day of Sukkot,"Many Jewish communities in countries such as the United States observe the last day of Sukkot, which marks the end of the Sukkot festival.",Hebrew,true,false,false,false
2019-10-21,Shmini Atzeret,"Shemini Atzeret (or Shmini Atzeret) is a Jewish holiday dedicated to the love of God, while Simchat Torah (Simchas Torah or Simhat Torah) marks the end of Sukkot and celebrates the completion of the annual reading of the Torah.",Hebrew,true,false,false,false
2019-10-22,Simchat Torah,Simchat Torah (Simchas Torah or Simhat Torah) is a Jewish holiday that marks the end of Sukkot and celebrates the completion of the annual reading of the Torah.,Hebrew,true,false,false,false
2019-10-23,,,,false,false,false,false
2019-10-24,World Development Information Day,The United Nations' (UN) World Development Information Day falls on October 24 each year.,United Nations observance,false,false,false,false
2019-10-24,United Nations Day,United Nations Day marks the anniversary of the United Nations Charter coming into force in 1945 and celebrates the work of this organization. United Nations Day annually falls on October 24.,United Nations observance,false,false,false,false
